{
  "schema_version": "1.6",
  "candidate_id": "dark_shard_1:1:0-33",
  "profile_id": "tol_standard_dev",
  "max_bucket_occupancy_observed": 3,
  "seed_triplets_evaluated": 16,
  "memory_estimate_mb": 4.5,
  "runtime_ms": 12.0,
  "relaxed_profiles_tried": ["narrow", "standard"],
  "guard_triggered": false,
  "failure_reason": null
}
